ID,Name,Botanical name,vine,bamboo,tree,shrub,cactus,edible,ornam.,fragrant,medicinal,wood,height range (m),germination time,germination comment,germination instructions,Description
183,Cut-leaved European Beech,Fagus Sylvatica Laciniata,n,n,y,n,n,n,n,n,n,,20-40,Variable,often requires stratification,"Fagus sylvatica 'Laciniata', also known as the Cutleaf Beech, is a deciduous tree prized for its elegant, deeply dissected leaves. These leaves, typically a vibrant green in spring and summer, transform to a copper-brown in autumn, often persisting on the branches through winter, providing year-round interest. Its smooth, grey bark and graceful, spreading habit create a striking silhouette in the landscape, making it a popular choice as a specimen tree in larger gardens and parks. It's a slow-growing cultivar of the European Beech, offering a unique textural contrast compared to its parent species.","Fagus sylvatica 'Laciniata', also known as the Cutleaf Beech, is a deciduous tree prized for its elegant, deeply dissected leaves. These leaves, typically a vibrant green in spring and summer, transform to a copper-brown in autumn, often persisting on the branches through winter, providing year-round interest. Its smooth, grey bark and graceful, spreading habit create a striking silhouette in the landscape, making it a popular choice as a specimen tree in larger gardens and parks. It's a slow-growing cultivar of the European Beech, offering a unique textural contrast compared to its parent species."
184,Fontanesia,Fontanesia phillyreoides,n,n,n,y,n,n,y,n,n,,3-5,2-3 weeks,,"Fontanesia phillyreoides, also known as the Fontanesia or Oleaster-leaved Fontanesia, is a deciduous shrub or small tree belonging to the olive family (Oleaceae). Native to China and Korea, it is characterized by its opposite, willow-like leaves that resemble those of the olive family. It produces small, inconspicuous greenish-white flowers in panicles during the spring, followed by winged samaras that aid in seed dispersal. Fontanesia is generally a low-maintenance plant, valued for its resilience and adaptability to various soil conditions, making it suitable for hedging, screening, or as a standalone specimen in gardens.","Fontanesia phillyreoides, also known as the Fontanesia or Oleaster-leaved Fontanesia, is a deciduous shrub or small tree belonging to the olive family (Oleaceae). Native to China and Korea, it is characterized by its opposite, willow-like leaves that resemble those of the olive family. It produces small, inconspicuous greenish-white flowers in panicles during the spring, followed by winged samaras that aid in seed dispersal. Fontanesia is generally a low-maintenance plant, valued for its resilience and adaptability to various soil conditions, making it suitable for hedging, screening, or as a standalone specimen in gardens."
185,Cornus Florida,Cornus Florida,n,n,y,y,n,n,y,y,n,,5-10,Variable,often needs stratification,"Cornus florida, commonly known as the flowering dogwood, is a small, deciduous tree native to eastern North America. Celebrated for its stunning springtime display, it features four showy, petal-like bracts (modified leaves) surrounding a cluster of tiny, inconspicuous yellow-green flowers. These bracts typically range from white to pink, and in autumn, the tree offers vibrant red foliage and bright red berries that attract birds.  Flowering dogwoods prefer well-drained, acidic soil and partial shade, and are often planted as ornamentals in gardens and parks for their year-round visual appeal.","Cornus florida, commonly known as the flowering dogwood, is a small, deciduous tree native to eastern North America. Celebrated for its stunning springtime display, it features four showy, petal-like bracts (modified leaves) surrounding a cluster of tiny, inconspicuous yellow-green flowers. These bracts typically range from white to pink, and in autumn, the tree offers vibrant red foliage and bright red berries that attract birds.  Flowering dogwoods prefer well-drained, acidic soil and partial shade, and are often planted as ornamentals in gardens and parks for their year-round visual appeal."
186,Japanese supple-jack,Berchemia floribunda,y,n,y,n,n,n,n,n,n,,5-10,2-3 weeks,,"Berchemia floribunda, also known as the Himalayan Supplejack, is a vigorous, climbing woody vine native to the Himalayas and parts of Southeast Asia. This deciduous climber boasts glossy, ovate leaves and produces panicles of small, greenish-white flowers in the summer, followed by small, black, berry-like drupes that ripen in the fall. Known for its incredibly flexible and strong stems, it is often used in traditional crafts and construction. It prefers a sheltered location with well-drained soil and can add a unique and exotic touch to gardens where its climbing habit can be accommodated.","Berchemia floribunda, also known as the Himalayan Supplejack, is a vigorous, climbing woody vine native to the Himalayas and parts of Southeast Asia. This deciduous climber boasts glossy, ovate leaves and produces panicles of small, greenish-white flowers in the summer, followed by small, black, berry-like drupes that ripen in the fall. Known for its incredibly flexible and strong stems, it is often used in traditional crafts and construction. It prefers a sheltered location with well-drained soil and can add a unique and exotic touch to gardens where its climbing habit can be accommodated."
187,European Red Raspberry,Rubus idaeus,y,n,n,y,n,y,n,n,n,,1-2,2-3 weeks,,"Rubus idaeus, commonly known as the raspberry, is a perennial shrub belonging to the rose family. This deciduous plant produces thorny, upright canes and distinctive compound leaves. It is cultivated for its delicious and nutritious red or yellow berries, which are widely enjoyed fresh, processed into jams and desserts, or used in various culinary applications. Raspberries are also valued for their medicinal properties and are a popular choice for home gardens and commercial fruit production.","Rubus idaeus, commonly known as the raspberry, is a perennial shrub belonging to the rose family. This deciduous plant produces thorny, upright canes and distinctive compound leaves. It is cultivated for its delicious and nutritious red or yellow berries, which are widely enjoyed fresh, processed into jams and desserts, or used in various culinary applications. Raspberries are also valued for their medicinal properties and are a popular choice for home gardens and commercial fruit production."
188,Japanese Pagoda Tree,Styphnolobium japonicum,n,n,y,n,n,n,y,y,y,,20-30,1-2 weeks,,"Styphnolobium japonicum, commonly known as the Japanese pagoda tree or Chinese scholar tree, is a deciduous tree native to East Asia but widely cultivated in other parts of the world. It's valued for its elegant, spreading crown, pinnately compound leaves that turn yellow in the fall, and fragrant, creamy-white, pea-like flowers that bloom in late summer, providing a valuable nectar source for pollinators when other trees have finished flowering. While slow-growing, it can reach impressive heights and lives for many years, making it a popular choice for parks, large gardens, and street plantings, though its messy seed pods and potential for brittle branches can sometimes be a drawback.","Styphnolobium japonicum, commonly known as the Japanese pagoda tree or Chinese scholar tree, is a deciduous tree native to East Asia but widely cultivated in other parts of the world. It's valued for its elegant, spreading crown, pinnately compound leaves that turn yellow in the fall, and fragrant, creamy-white, pea-like flowers that bloom in late summer, providing a valuable nectar source for pollinators when other trees have finished flowering. While slow-growing, it can reach impressive heights and lives for many years, making it a popular choice for parks, large gardens, and street plantings, though its messy seed pods and potential for brittle branches can sometimes be a drawback."
189,Blue Sausage Tree,Decaisnea fargesii,n,n,y,n,n,y,n,n,n,,3-5,Variable,,"Decaisnea fargesii, commonly known as Dead Man's Fingers, is a striking deciduous shrub or small tree native to western China. It's prized for its unusual, bright blue, sausage-shaped fruits that hang in clusters during the autumn, resembling, well, dead man's fingers. This plant boasts attractive, pinnately compound leaves that provide a lush, tropical-like foliage display throughout the growing season, and small, greenish-yellow flowers in drooping panicles during the spring. Its bold texture and unique fruit make it a conversation starter in any garden, adding a touch of the exotic and slightly macabre.","Decaisnea fargesii, commonly known as Dead Man's Fingers, is a striking deciduous shrub or small tree native to western China. It's prized for its unusual, bright blue, sausage-shaped fruits that hang in clusters during the autumn, resembling, well, dead man's fingers. This plant boasts attractive, pinnately compound leaves that provide a lush, tropical-like foliage display throughout the growing season, and small, greenish-yellow flowers in drooping panicles during the spring. Its bold texture and unique fruit make it a conversation starter in any garden, adding a touch of the exotic and slightly macabre."
190,Nashi,Pyrus pyrifolia,n,n,y,n,n,y,y,y,n,,5-10,1-2 weeks,,"Pyrus pyrifolia, commonly known as Asian pear, nashi pear, or apple pear, is a species of pear native to East Asia.  Distinct from European pears, it bears crisp, round fruits that resemble apples in appearance and texture, ranging in color from pale yellow to russet brown. These pears are known for their juicy, slightly grainy flesh, mild sweetness, and refreshing flavor, and are often eaten fresh or used in salads and desserts. The tree itself is deciduous, bearing white flowers in spring and requiring specific chilling hours for optimal fruit production.","Pyrus pyrifolia, commonly known as Asian pear, nashi pear, or apple pear, is a species of pear native to East Asia.  Distinct from European pears, it bears crisp, round fruits that resemble apples in appearance and texture, ranging in color from pale yellow to russet brown. These pears are known for their juicy, slightly grainy flesh, mild sweetness, and refreshing flavor, and are often eaten fresh or used in salads and desserts. The tree itself is deciduous, bearing white flowers in spring and requiring specific chilling hours for optimal fruit production."
191,Narrow Leaved Ash,Fraxinus angustifolia,n,n,y,n,n,n,n,n,y,,20-30,Variable,often requires stratification,"Fraxinus angustifolia, commonly known as the narrow-leaved ash, is a medium-sized deciduous tree native to central and southern Europe, northwest Africa, and southwest Asia.  It's characterized by its relatively narrow, lance-shaped leaflets arranged in opposite pairs along the leaf stalk, and its grayish-brown bark that becomes fissured with age.  The tree produces winged seeds called samaras, which aid in wind dispersal, and is adaptable to a variety of soil conditions, often found in riparian habitats and floodplains.  While valued for its timber, it's increasingly susceptible to ash dieback, a fungal disease threatening ash populations across Europe.","Fraxinus angustifolia, commonly known as the narrow-leaved ash, is a medium-sized deciduous tree native to central and southern Europe, northwest Africa, and southwest Asia.  It's characterized by its relatively narrow, lance-shaped leaflets arranged in opposite pairs along the leaf stalk, and its grayish-brown bark that becomes fissured with age.  The tree produces winged seeds called samaras, which aid in wind dispersal, and is adaptable to a variety of soil conditions, often found in riparian habitats and floodplains.  While valued for its timber, it's increasingly susceptible to ash dieback, a fungal disease threatening ash populations across Europe."
192,Ginko,Ginkgo biloba,n,n,y,n,n,n,n,n,n,,20-35,Variable,requires stratification,"Ginkgo biloba, often simply called Ginkgo, is a unique and ancient tree species known for its distinctive fan-shaped leaves and resilience. Native to China, it's considered a living fossil, with fossil records dating back millions of years. Ginkgo trees are prized for their ornamental value, vibrant golden fall foliage, and purported health benefits, including improved memory and cognitive function. While the fleshy fruit produced by female trees has a strong, unpleasant odor, the roasted seeds are a traditional food in some cultures. Ginkgo's hardiness and tolerance of pollution make it a popular choice for urban environments.","Ginkgo biloba, often simply called Ginkgo, is a unique and ancient tree species known for its distinctive fan-shaped leaves and resilience. Native to China, it's considered a living fossil, with fossil records dating back millions of years. Ginkgo trees are prized for their ornamental value, vibrant golden fall foliage, and purported health benefits, including improved memory and cognitive function. While the fleshy fruit produced by female trees has a strong, unpleasant odor, the roasted seeds are a traditional food in some cultures. Ginkgo's hardiness and tolerance of pollution make it a popular choice for urban environments."
193,Fishtail Palm Tree,Caryota,n,n,y,n,n,n,n,n,n,,10-20,Variable,,"Caryota, also known as fishtail palms, are a genus of striking palm trees characterized by their unique, bi-pinnate leaves that resemble the tail of a fish. Native to Asia, Australia, and the Pacific Islands, these palms range in size from small, clumping varieties to massive, solitary trees. They are admired for their dramatic foliage and the pendant clusters of flowers they produce, which unfortunately leads to the death of the individual stem after fruiting, making them monocarpic. While the sap can be irritating to the skin, some species are cultivated for their ornamental value and their edible starch content.","Caryota, also known as fishtail palms, are a genus of striking palm trees characterized by their unique, bi-pinnate leaves that resemble the tail of a fish. Native to Asia, Australia, and the Pacific Islands, these palms range in size from small, clumping varieties to massive, solitary trees. They are admired for their dramatic foliage and the pendant clusters of flowers they produce, which unfortunately leads to the death of the individual stem after fruiting, making them monocarpic. While the sap can be irritating to the skin, some species are cultivated for their ornamental value and their edible starch content."
194,Oriental Sweet Gum,Liquidambar orientalis,n,n,y,n,n,n,n,y,y,,15-25,2-3 weeks,,"Liquidambar orientalis, also known as Turkish Sweetgum or Oriental Sweetgum, is a deciduous tree native to a small region in southwestern Turkey. It is prized for its aromatic resin, known as storax, which has been used in perfumes, incense, and traditional medicine for centuries. This medium-sized tree boasts deeply lobed, maple-like leaves that turn vibrant shades of red, orange, and purple in the fall. Its bark is grayish-brown and deeply furrowed, and it produces spherical, spiky fruits that persist throughout the winter, adding ornamental interest. Unlike its American cousin, Liquidambar styraciflua, L. orientalis is relatively small, slow-growing, and more tolerant of alkaline soils.","Liquidambar orientalis, also known as Turkish Sweetgum or Oriental Sweetgum, is a deciduous tree native to a small region in southwestern Turkey. It is prized for its aromatic resin, known as storax, which has been used in perfumes, incense, and traditional medicine for centuries. This medium-sized tree boasts deeply lobed, maple-like leaves that turn vibrant shades of red, orange, and purple in the fall. Its bark is grayish-brown and deeply furrowed, and it produces spherical, spiky fruits that persist throughout the winter, adding ornamental interest. Unlike its American cousin, Liquidambar styraciflua, L. orientalis is relatively small, slow-growing, and more tolerant of alkaline soils."
195,Blackberry,Rubus fruticosus species aggregate,y,n,n,y,n,y,n,n,n,,1-2,2-3 weeks,,"The Rubus fruticosus species aggregate, commonly known as brambles or blackberries, is a highly complex group of closely related, apomictic (reproducing asexually) plant species within the genus Rubus. Native to Europe, they are sprawling, thorny shrubs with biennial stems (canes) that produce delicious, dark-colored berries. Due to their apomictic nature and tendency to hybridize readily, the classification of individual species within the aggregate is notoriously difficult, leading to a wide variety of morphologically similar forms and ongoing debate among botanists. Despite this complexity, brambles are widely recognized for their ecological importance, providing food and shelter for wildlife, and for their economic value as a popular fruit crop.","The Rubus fruticosus species aggregate, commonly known as brambles or blackberries, is a highly complex group of closely related, apomictic (reproducing asexually) plant species within the genus Rubus. Native to Europe, they are sprawling, thorny shrubs with biennial stems (canes) that produce delicious, dark-colored berries. Due to their apomictic nature and tendency to hybridize readily, the classification of individual species within the aggregate is notoriously difficult, leading to a wide variety of morphologically similar forms and ongoing debate among botanists. Despite this complexity, brambles are widely recognized for their ecological importance, providing food and shelter for wildlife, and for their economic value as a popular fruit crop."
196,Rosemary-leaved Willow,Salix Rosmarinifolia,n,n,n,y,n,n,n,y,n,,1-3,1-2 weeks,,"Salix rosmarinifolia, commonly known as rosemary willow or hoary willow, is a deciduous shrub characterized by its narrow, rosemary-like, bluish-green leaves that are silvery-white underneath due to fine hairs. This willow typically grows in a dense, upright form and produces small, inconspicuous catkins in early spring before the leaves emerge. Hardy and adaptable, rosemary willow is often used in ornamental landscaping, particularly in areas with moist or wet soils, adding textural interest with its unique foliage and attractive winter stems. It is favored for its ability to control erosion and provide habitat for wildlife.","Salix rosmarinifolia, commonly known as rosemary willow or hoary willow, is a deciduous shrub characterized by its narrow, rosemary-like, bluish-green leaves that are silvery-white underneath due to fine hairs. This willow typically grows in a dense, upright form and produces small, inconspicuous catkins in early spring before the leaves emerge. Hardy and adaptable, rosemary willow is often used in ornamental landscaping, particularly in areas with moist or wet soils, adding textural interest with its unique foliage and attractive winter stems. It is favored for its ability to control erosion and provide habitat for wildlife."
197,Passion Fruit,Passiflora edulis,y,n,n,n,n,y,y,y,n,,5-10 (vine),2-3 weeks,,"Passiflora edulis, commonly known as passion fruit, is a vigorous, tropical vine admired for its fragrant, exotic flowers and delicious, juicy fruit. The vine climbs via tendrils and boasts glossy, three-lobed leaves. Its captivating flowers feature a striking corona of colorful filaments surrounding prominent stamens and pistils. The fruit, typically purple or yellow when ripe, has a wrinkled rind enclosing a pulp filled with edible seeds, offering a sweet and tart flavor that's enjoyed fresh, in juices, desserts, and sauces. Widely cultivated in warm climates, the passion fruit is prized for its unique flavor and versatility.","Passiflora edulis, commonly known as passion fruit, is a vigorous, tropical vine admired for its fragrant, exotic flowers and delicious, juicy fruit. The vine climbs via tendrils and boasts glossy, three-lobed leaves. Its captivating flowers feature a striking corona of colorful filaments surrounding prominent stamens and pistils. The fruit, typically purple or yellow when ripe, has a wrinkled rind enclosing a pulp filled with edible seeds, offering a sweet and tart flavor that's enjoyed fresh, in juices, desserts, and sauces. Widely cultivated in warm climates, the passion fruit is prized for its unique flavor and versatility."
198,Australian banyan,Ficus Macrphylia,n,n,y,n,n,n,n,n,y,,20-40,2-,,"Ficus macrophylla, commonly known as the Moreton Bay fig, is a massive and iconic strangler fig native to eastern Australia. Its most distinctive features are its enormous size, often exceeding 150 feet in height and width, and its impressive buttress roots that spread outwards from the trunk, providing support and creating a unique architectural presence. The tree has large, leathery, dark green leaves and produces small, inedible figs that attract various wildlife.  Though a spectacular sight, its aggressive root system can be destructive to infrastructure, making it best suited for large parks and open spaces.","Ficus macrophylla, commonly known as the Moreton Bay fig, is a massive and iconic strangler fig native to eastern Australia. Its most distinctive features are its enormous size, often exceeding 150 feet in height and width, and its impressive buttress roots that spread outwards from the trunk, providing support and creating a unique architectural presence. The tree has large, leathery, dark green leaves and produces small, inedible figs that attract various wildlife.  Though a spectacular sight, its aggressive root system can be destructive to infrastructure, making it best suited for large parks and open spaces."
199,Gliricidia,Gliricidia Sepium,n,n,y,y,n,n,y,y,y,,10-15,1-2 weeks,,"Gliricidia sepium, often called ""Madre de Cacao"" or ""Quickstick,"" is a fast-growing, leguminous tree native to Central America but now widely cultivated in tropical and subtropical regions. It's a highly versatile species valued for its nitrogen-fixing abilities, making it excellent for soil improvement, erosion control, and agroforestry. Its branches are easily propagated as live fences, while the leaves provide valuable green manure, livestock fodder, and even insecticidal properties. Gliricidia sepium plays a significant role in sustainable agriculture by enhancing soil fertility and providing various ecosystem services.","Gliricidia sepium, often called ""Madre de Cacao"" or ""Quickstick,"" is a fast-growing, leguminous tree native to Central America but now widely cultivated in tropical and subtropical regions. It's a highly versatile species valued for its nitrogen-fixing abilities, making it excellent for soil improvement, erosion control, and agroforestry. Its branches are easily propagated as live fences, while the leaves provide valuable green manure, livestock fodder, and even insecticidal properties. Gliricidia sepium plays a significant role in sustainable agriculture by enhancing soil fertility and providing various ecosystem services."
200,Sacred Fig,Ficus Religiosa,n,n,y,n,n,n,n,n,y,,20-30,2-4 weeks,,"Ficus religiosa, also known as the Bodhi tree or sacred fig, is a large, deciduous or semi-evergreen tree native to the Indian subcontinent and Indochina. Revered in Hinduism, Buddhism, and Jainism, it's renowned for its distinctive heart-shaped leaves with elongated ""drip tips"" and its ability to grow to impressive sizes.  The tree's cultural and spiritual significance stems from the belief that Siddhartha Gautama, the Buddha, attained enlightenment while meditating under one of these trees. It is also recognized for its medicinal properties and its role in providing shade and shelter, making it a cherished and protected species in its native regions.","Ficus religiosa, also known as the Bodhi tree or sacred fig, is a large, deciduous or semi-evergreen tree native to the Indian subcontinent and Indochina. Revered in Hinduism, Buddhism, and Jainism, it's renowned for its distinctive heart-shaped leaves with elongated ""drip tips"" and its ability to grow to impressive sizes.  The tree's cultural and spiritual significance stems from the belief that Siddhartha Gautama, the Buddha, attained enlightenment while meditating under one of these trees. It is also recognized for its medicinal properties and its role in providing shade and shelter, making it a cherished and protected species in its native regions."
201,Papaya,Carica Papaya,n,n,y,n,n,y,n,n,n,,5-10,1-2 weeks,,"Carica papaya, commonly known as papaya, is a tropical fruit-bearing tree native to Central America. It's characterized by its single, slender trunk, topped with a crown of large, palmate leaves. The fruit itself is a large, oval or pear-shaped berry that ripens to a vibrant orange or yellowish color, boasting a sweet and slightly musky flavor. Papaya is not only consumed fresh but also used in cooking, traditional medicine, and as a source of papain, an enzyme with various industrial applications.","Carica papaya, commonly known as papaya, is a tropical fruit-bearing tree native to Central America. It's characterized by its single, slender trunk, topped with a crown of large, palmate leaves. The fruit itself is a large, oval or pear-shaped berry that ripens to a vibrant orange or yellowish color, boasting a sweet and slightly musky flavor. Papaya is not only consumed fresh but also used in cooking, traditional medicine, and as a source of papain, an enzyme with various industrial applications."
