ID,Name,Botanical name,vine,bamboo,tree,shrub,cactus,edible,ornam.,fragrant,medicinal,wood,height range (m),germination time,germination comment,germination instructions,Description
1,European Hornbeam,Carpinus Betulus,n,n,y,n,n,n,n,n,n,,15-20,Variable,often slow,"Carpinus betulus, commonly known as the European Hornbeam, is a deciduous tree native to Europe and Western Asia. Often confused with beech trees, it boasts a smooth, grey bark and distinctive muscle-like fluting on its trunk as it matures. Its oval leaves are deeply ribbed and turn a beautiful golden-yellow in autumn before persisting on the branches throughout winter, providing year-round interest. The European Hornbeam is a hardy and adaptable tree, frequently used for hedging, topiary, and formal landscaping due to its tolerance of pruning and ability to create dense, formal shapes.","Carpinus betulus, commonly known as the European Hornbeam, is a deciduous tree native to Europe and Western Asia. Often confused with beech trees, it boasts a smooth, grey bark and distinctive muscle-like fluting on its trunk as it matures. Its oval leaves are deeply ribbed and turn a beautiful golden-yellow in autumn before persisting on the branches throughout winter, providing year-round interest. The European Hornbeam is a hardy and adaptable tree, frequently used for hedging, topiary, and formal landscaping due to its tolerance of pruning and ability to create dense, formal shapes."
2,Giant Bamboo,Dendrocalamus Giganteus,n,y,n,n,n,n,n,n,n,y,20-35,1-2 weeks,,"Dendrocalamus giganteus, often called giant bamboo, is a colossal species native to Southeast Asia, renowned for being one of the largest bamboo species in the world. Its towering culms can reach up to 100 feet tall and a foot in diameter, making it a truly impressive sight. This fast-growing bamboo is highly valued for its strong and versatile timber, which is used in construction, furniture making, and various other applications. Beyond its practical uses, Dendrocalamus giganteus also adds a majestic and tropical aesthetic to landscapes.","Dendrocalamus giganteus, often called giant bamboo, is a colossal species native to Southeast Asia, renowned for being one of the largest bamboo species in the world. Its towering culms can reach up to 100 feet tall and a foot in diameter, making it a truly impressive sight. This fast-growing bamboo is highly valued for its strong and versatile timber, which is used in construction, furniture making, and various other applications. Beyond its practical uses, Dendrocalamus giganteus also adds a majestic and tropical aesthetic to landscapes."
3,Brazil Nut,Bertholletia Excelsia,n,n,y,n,n,y,n,n,n,,30-50,Variable,can be several months,"Bertholletia excelsa, more commonly known as the Brazil nut tree, is a massive South American rainforest tree prized for its nutrient-rich nuts. Reaching heights of up to 50 meters, these trees produce large, woody capsules containing 10-25 Brazil nuts. They are highly dependent on specific symbiotic relationships with certain bee species for pollination and agoutis for seed dispersal, making sustainable harvesting crucial for their long-term survival. Beyond their edible nuts, the tree's timber and oil are also utilized, contributing to the livelihoods of local communities within the Amazon basin.","Bertholletia excelsa, more commonly known as the Brazil nut tree, is a massive South American rainforest tree prized for its nutrient-rich nuts. Reaching heights of up to 50 meters, these trees produce large, woody capsules containing 10-25 Brazil nuts. They are highly dependent on specific symbiotic relationships with certain bee species for pollination and agoutis for seed dispersal, making sustainable harvesting crucial for their long-term survival. Beyond their edible nuts, the tree's timber and oil are also utilized, contributing to the livelihoods of local communities within the Amazon basin."
4,Red Banana,Musa Acuminata,n,n,n,n,n,y,n,n,n,,2-5,Variable,2-3 weeks optimal,"Musa acuminata is a species of banana native to Southeast Asia, prized as the primary ancestor of most cultivated banana varieties we consume today. Characterized by its soft, sweet fruit and relatively smaller size compared to some other banana species, it has been selectively bred over centuries to produce the Cavendish and other popular cultivars. Beyond its edible fruit, Musa acuminata also contributes to local economies and cultures, with its leaves used for wrapping food and its fibers woven into textiles. Its adaptability and genetic diversity have made it a cornerstone of the global banana industry.","Musa acuminata is a species of banana native to Southeast Asia, prized as the primary ancestor of most cultivated banana varieties we consume today. Characterized by its soft, sweet fruit and relatively smaller size compared to some other banana species, it has been selectively bred over centuries to produce the Cavendish and other popular cultivars. Beyond its edible fruit, Musa acuminata also contributes to local economies and cultures, with its leaves used for wrapping food and its fibers woven into textiles. Its adaptability and genetic diversity have made it a cornerstone of the global banana industry."
5,Common Maple,Acer Campestre,n,n,y,n,n,n,n,n,n,,10-20,2-3 weeks,,"Acer campestre, commonly known as the field maple, is a medium-sized deciduous tree native to Europe and western Asia. Reaching heights of up to 20 meters, it's characterized by its rounded crown, smooth grey-brown bark that becomes fissured with age, and distinctive five-lobed leaves that turn a vibrant yellow in autumn.  Small, greenish-yellow flowers appear in spring, followed by winged samaras (seeds) that are dispersed by the wind. Tolerant of a wide range of soil conditions and pollution, the field maple is often used for hedging, screening, and as a street tree in urban environments.","Acer campestre, commonly known as the field maple, is a medium-sized deciduous tree native to Europe and western Asia. Reaching heights of up to 20 meters, it's characterized by its rounded crown, smooth grey-brown bark that becomes fissured with age, and distinctive five-lobed leaves that turn a vibrant yellow in autumn.  Small, greenish-yellow flowers appear in spring, followed by winged samaras (seeds) that are dispersed by the wind. Tolerant of a wide range of soil conditions and pollution, the field maple is often used for hedging, screening, and as a street tree in urban environments."
6,Birch,Betula Penduia,n,n,y,n,n,n,n,n,n,,15-30,1-2 weeks,,"Betula pendula, commonly known as the silver birch or weeping birch, is a medium-sized deciduous tree characterized by its striking white bark, often peeling in papery layers, and slender, drooping branches that give it a graceful, weeping appearance. Its leaves are triangular to diamond-shaped with serrated edges, turning a vibrant yellow in autumn. This hardy tree is a pioneer species, thriving in various soil conditions and tolerating both sun and partial shade. Its delicate catkins produce seeds dispersed by the wind, contributing to its widespread distribution across Europe and parts of Asia.","Betula pendula, commonly known as the silver birch or weeping birch, is a medium-sized deciduous tree characterized by its striking white bark, often peeling in papery layers, and slender, drooping branches that give it a graceful, weeping appearance. Its leaves are triangular to diamond-shaped with serrated edges, turning a vibrant yellow in autumn. This hardy tree is a pioneer species, thriving in various soil conditions and tolerating both sun and partial shade. Its delicate catkins produce seeds dispersed by the wind, contributing to its widespread distribution across Europe and parts of Asia."
7,Ash,Fraxinus,n,n,y,n,n,n,n,n,n,,20-35,Variable,often requires stratification,"Fraxinus, commonly known as ash trees, is a genus of flowering plants in the olive family, Oleaceae. These deciduous trees are native to most of Europe, Asia, and North America, typically found in temperate regions. Ash trees are valued for their strong, durable wood, used in tool handles, baseball bats, and furniture. They are characterized by their pinnately compound leaves, opposite branching patterns, and clusters of winged fruits called samaras. Unfortunately, many ash species are currently threatened by the emerald ash borer, an invasive insect that has devastated ash populations across North America.","Fraxinus, commonly known as ash trees, is a genus of flowering plants in the olive family, Oleaceae. These deciduous trees are native to most of Europe, Asia, and North America, typically found in temperate regions. Ash trees are valued for their strong, durable wood, used in tool handles, baseball bats, and furniture. They are characterized by their pinnately compound leaves, opposite branching patterns, and clusters of winged fruits called samaras. Unfortunately, many ash species are currently threatened by the emerald ash borer, an invasive insect that has devastated ash populations across North America."
8,Lime Tree,Tilia,n,n,y,n,n,n,n,y,n,,20-40,2-3 weeks,,"Tilia, also known as linden or basswood, is a genus of deciduous trees characterized by their heart-shaped leaves, fragrant, creamy-white flowers that attract bees, and distinctive bracts attached to the flower clusters. These medium to large-sized trees are commonly found in temperate regions of the Northern Hemisphere and are valued for their shade-providing canopy, ornamental qualities, and the medicinal properties attributed to their flowers. Tilia wood is also prized for carving and woodworking due to its soft texture and ease of shaping.","Tilia, also known as linden or basswood, is a genus of deciduous trees characterized by their heart-shaped leaves, fragrant, creamy-white flowers that attract bees, and distinctive bracts attached to the flower clusters. These medium to large-sized trees are commonly found in temperate regions of the Northern Hemisphere and are valued for their shade-providing canopy, ornamental qualities, and the medicinal properties attributed to their flowers. Tilia wood is also prized for carving and woodworking due to its soft texture and ease of shaping."
9,European Beech,Fagus Sylvatical,n,n,y,n,n,n,n,n,n,,20-40,Variable,often requires stratification,"Fagus sylvatica, commonly known as the European beech, is a majestic deciduous tree native to Europe. Renowned for its smooth, gray bark and elegantly spreading crown, it can reach impressive heights and ages, often dominating woodland landscapes. Its leaves are oval-shaped with gently wavy margins, turning a vibrant copper-bronze in autumn before eventually dropping.  Beech trees produce beechnuts, small triangular nuts enclosed in prickly cups, which are an important food source for wildlife. Often planted ornamentally, it is prized for its shade, beauty, and longevity.","Fagus sylvatica, commonly known as the European beech, is a majestic deciduous tree native to Europe. Renowned for its smooth, gray bark and elegantly spreading crown, it can reach impressive heights and ages, often dominating woodland landscapes. Its leaves are oval-shaped with gently wavy margins, turning a vibrant copper-bronze in autumn before eventually dropping.  Beech trees produce beechnuts, small triangular nuts enclosed in prickly cups, which are an important food source for wildlife. Often planted ornamentally, it is prized for its shade, beauty, and longevity."
10,Tulip Tree,Liriodendron,n,n,y,n,n,n,y,n,y,,25-50,Variable,often slow and requires stratification,"Liriodendron, commonly known as tulip trees or tulip poplars, are stately deciduous trees prized for their unique, tulip-shaped leaves and striking, cup-like flowers that bloom in late spring. These fast-growing trees boast a straight trunk and a pyramidal crown, eventually maturing into large specimens that can reach impressive heights.  Their leaves turn a vibrant golden-yellow in autumn, providing a beautiful display of fall color.  Liriodendron are valued as ornamental trees in parks and large gardens, and their wood is also used for furniture making and other applications.","Liriodendron, commonly known as tulip trees or tulip poplars, are stately deciduous trees prized for their unique, tulip-shaped leaves and striking, cup-like flowers that bloom in late spring. These fast-growing trees boast a straight trunk and a pyramidal crown, eventually maturing into large specimens that can reach impressive heights.  Their leaves turn a vibrant golden-yellow in autumn, providing a beautiful display of fall color.  Liriodendron are valued as ornamental trees in parks and large gardens, and their wood is also used for furniture making and other applications."
11,Blood Orange,Citrus Sinensis Doppio Sanguinello,n,n,y,n,n,y,y,y,n,,5-10,1-2 weeks,,"Citrus Sinensis Doppio Sanguinilo, commonly known as the Double Blood Orange, is a captivating variety prized for its intensely pigmented flesh, ranging from deep ruby to almost black. This Italian cultivar boasts a complex and tart-sweet flavor profile with distinctive raspberry-like notes, making it highly sought after for juices, culinary applications, and even cocktails. Its rind also often displays a reddish blush, hinting at the vibrant treasure held within. Doppio Sanguinilo oranges are typically medium-sized and ripen later in the citrus season, offering a burst of color and flavor during the winter months.","Citrus Sinensis Doppio Sanguinilo, commonly known as the Double Blood Orange, is a captivating variety prized for its intensely pigmented flesh, ranging from deep ruby to almost black. This Italian cultivar boasts a complex and tart-sweet flavor profile with distinctive raspberry-like notes, making it highly sought after for juices, culinary applications, and even cocktails. Its rind also often displays a reddish blush, hinting at the vibrant treasure held within. Doppio Sanguinilo oranges are typically medium-sized and ripen later in the citrus season, offering a burst of color and flavor during the winter months."
12,Japanse Marple,Acer Palmatum,n,n,y,n,n,n,y,n,n,,6-10 (often smaller),2-3 weeks,,"Acer palmatum, commonly known as Japanese maple, is a deciduous tree or shrub prized for its graceful form, vibrant foliage, and captivating seasonal color. Its delicate, palmate leaves, deeply divided into five to nine lobes, emerge in spring in shades of red, green, or purple, transforming into brilliant hues of crimson, orange, and gold in autumn.  Japanese maples range in size and shape, from small, weeping cultivars to upright, vase-shaped trees, making them versatile additions to gardens of various styles and sizes.  Their elegant structure and stunning colors offer year-round interest, establishing them as a beloved and highly sought-after ornamental tree.","Acer palmatum, commonly known as Japanese maple, is a deciduous tree or shrub prized for its graceful form, vibrant foliage, and captivating seasonal color. Its delicate, palmate leaves, deeply divided into five to nine lobes, emerge in spring in shades of red, green, or purple, transforming into brilliant hues of crimson, orange, and gold in autumn.  Japanese maples range in size and shape, from small, weeping cultivars to upright, vase-shaped trees, making them versatile additions to gardens of various styles and sizes.  Their elegant structure and stunning colors offer year-round interest, establishing them as a beloved and highly sought-after ornamental tree."
13,Apricote Tree,Prunus Armeniaca,n,n,y,n,n,y,y,y,n,,5-10,1-2 weeks,,"Prunus armeniaca, commonly known as the apricot, is a deciduous tree valued for its delicious, golden-orange fruit. Native to Central Asia, this tree typically grows to a moderate size, featuring a rounded crown and ovate leaves. In early spring, it bursts into bloom with delicate pink or white flowers, which are highly attractive to pollinators. The apricot fruit is characterized by its velvety skin, juicy flesh, and a single, large pit. Apricots are enjoyed fresh, dried, canned, or used in a variety of culinary applications.","Prunus armeniaca, commonly known as the apricot, is a deciduous tree valued for its delicious, golden-orange fruit. Native to Central Asia, this tree typically grows to a moderate size, featuring a rounded crown and ovate leaves. In early spring, it bursts into bloom with delicate pink or white flowers, which are highly attractive to pollinators. The apricot fruit is characterized by its velvety skin, juicy flesh, and a single, large pit. Apricots are enjoyed fresh, dried, canned, or used in a variety of culinary applications."
14,Caucasian lime,Tilia Euchlora,n,n,y,n,n,n,y,y,y,,20-30,2-3 weeks,,"Tilia euchlora, commonly known as Caucasian Lime or Crimean Linden, is a medium-sized deciduous tree prized for its symmetrical, broadly oval crown and graceful, arching branches. It features glossy, dark green leaves that are resistant to aphids, a common issue with other lime species. In mid-summer, it produces fragrant, pale yellow flowers that attract bees, followed by small, nut-like fruits. Highly adaptable to various soil conditions and urban environments, the Caucasian Lime makes an excellent shade tree and street tree due to its tolerance of pollution and minimal mess.","Tilia euchlora, commonly known as Caucasian Lime or Crimean Linden, is a medium-sized deciduous tree prized for its symmetrical, broadly oval crown and graceful, arching branches. It features glossy, dark green leaves that are resistant to aphids, a common issue with other lime species. In mid-summer, it produces fragrant, pale yellow flowers that attract bees, followed by small, nut-like fruits. Highly adaptable to various soil conditions and urban environments, the Caucasian Lime makes an excellent shade tree and street tree due to its tolerance of pollution and minimal mess."
15,Golden Rain Tree,Koelreuteria Paniculata,n,n,y,n,n,n,y,n,n,,10-15,1-2 weeks,,"Koelreuteria paniculata, commonly known as the golden rain tree, is a deciduous tree native to eastern Asia. It's prized for its stunning display of bright yellow flowers that bloom in late summer, followed by distinctive lantern-like seed pods that turn from green to a papery brown or pink. This medium-sized tree is relatively fast-growing and adaptable to various soil conditions, making it a popular choice for urban landscapes and parks. It typically features an irregular, spreading crown and pinnately compound leaves that provide attractive fall color before dropping.","Koelreuteria paniculata, commonly known as the golden rain tree, is a deciduous tree native to eastern Asia. It's prized for its stunning display of bright yellow flowers that bloom in late summer, followed by distinctive lantern-like seed pods that turn from green to a papery brown or pink. This medium-sized tree is relatively fast-growing and adaptable to various soil conditions, making it a popular choice for urban landscapes and parks. It typically features an irregular, spreading crown and pinnately compound leaves that provide attractive fall color before dropping."
16,Currant,Ribes Rubrum,n,n,n,y,n,y,n,n,n,,1-2,2-3 weeks,,"Ribes rubrum, commonly known as the red currant, is a deciduous shrub prized for its clusters of translucent, bright red berries. Native to parts of Europe, it typically grows to around 3-6 feet tall and features palmate leaves reminiscent of maple. The berries are tart and juicy, making them popular for jams, jellies, pies, and summer puddings. Red currants are relatively easy to grow in cooler climates and prefer well-drained soil and partial shade, making them a favorite addition to home gardens and commercial fruit farms alike.","Ribes rubrum, commonly known as the red currant, is a deciduous shrub prized for its clusters of translucent, bright red berries. Native to parts of Europe, it typically grows to around 3-6 feet tall and features palmate leaves reminiscent of maple. The berries are tart and juicy, making them popular for jams, jellies, pies, and summer puddings. Red currants are relatively easy to grow in cooler climates and prefer well-drained soil and partial shade, making them a favorite addition to home gardens and commercial fruit farms alike."
17,Amur Maple,Acer Ginnala,n,n,y,n,n,n,y,n,n,,5-10,2-3 weeks,,"Acer ginnala, commonly known as Amur maple, is a small, deciduous tree or large shrub native to northeastern Asia. Highly valued for its vibrant fall foliage that transitions from yellow to brilliant red, it's a popular ornamental tree for gardens and urban landscapes. Amur maples are relatively hardy and adaptable, tolerating a range of soil conditions and pollution. Its delicate, three-lobed leaves and fragrant, creamy-white flowers in spring add to its aesthetic appeal, making it a versatile and attractive choice for small yards, hedges, or as a specimen tree.","Acer ginnala, commonly known as Amur maple, is a small, deciduous tree or large shrub native to northeastern Asia. Highly valued for its vibrant fall foliage that transitions from yellow to brilliant red, it's a popular ornamental tree for gardens and urban landscapes. Amur maples are relatively hardy and adaptable, tolerating a range of soil conditions and pollution. Its delicate, three-lobed leaves and fragrant, creamy-white flowers in spring add to its aesthetic appeal, making it a versatile and attractive choice for small yards, hedges, or as a specimen tree."
18,Bladdernut,Staphyleaceae,n,n,y,n,n,n,n,n,n,,3-8,Variable,often slow,"Staphyleaceae, commonly known as the bladdernut family, is a small family of flowering plants comprising shrubs and small trees. They are characterized by their opposite, pinnately compound leaves and distinctive, bladder-like, inflated fruit capsules that contain hard, shiny seeds. These plants are typically found in temperate regions of the Northern Hemisphere and South America, and are often appreciated for their ornamental value, bearing clusters of white or pinkish flowers in the spring.","Staphyleaceae, commonly known as the bladdernut family, is a small family of flowering plants comprising shrubs and small trees. They are characterized by their opposite, pinnately compound leaves and distinctive, bladder-like, inflated fruit capsules that contain hard, shiny seeds. These plants are typically found in temperate regions of the Northern Hemisphere and South America, and are often appreciated for their ornamental value, bearing clusters of white or pinkish flowers in the spring."
19,Hony Locust,Gleditsia Triacanthos,n,n,y,n,n,n,y,y,y,,20-30,1-2 weeks,,"Gleditsia triacanthos, commonly known as the Honey Locust, is a deciduous tree native to central North America, characterized by its fast growth and adaptability to various soil conditions. It features compound leaves, fragrant greenish-white flowers in spring, and long, twisted seed pods in the fall.  Although typically thorny, especially in the wild, many cultivars have been developed to be thornless, making them popular choices for landscaping.  Honey Locusts are valued for their filtered shade, drought tolerance, and use as a nitrogen-fixing pioneer species.","Gleditsia triacanthos, commonly known as the Honey Locust, is a deciduous tree native to central North America, characterized by its fast growth and adaptability to various soil conditions. It features compound leaves, fragrant greenish-white flowers in spring, and long, twisted seed pods in the fall.  Although typically thorny, especially in the wild, many cultivars have been developed to be thornless, making them popular choices for landscaping.  Honey Locusts are valued for their filtered shade, drought tolerance, and use as a nitrogen-fixing pioneer species."
20,Tatarian Maple,Acer Tataricum,n,n,y,n,n,n,y,n,n,,4-10,2-3 weeks,,"Acer tataricum, also known as the Tatarian maple, is a small, deciduous tree or large shrub native to southeastern Europe and southwestern Asia. It typically reaches a height of 15-20 feet and features an oval to rounded crown. Notable for its attractive, three-lobed leaves that turn a vibrant red or yellow in the fall, the Tatarian maple also produces fragrant, creamy-white flowers in the spring followed by bright red samaras (winged seeds) that persist well into the winter, providing visual interest and food for wildlife. Relatively adaptable to various soil conditions and tolerant of urban environments, it's often used as an ornamental tree in parks and gardens.","Acer tataricum, also known as the Tatarian maple, is a small, deciduous tree or large shrub native to southeastern Europe and southwestern Asia. It typically reaches a height of 15-20 feet and features an oval to rounded crown. Notable for its attractive, three-lobed leaves that turn a vibrant red or yellow in the fall, the Tatarian maple also produces fragrant, creamy-white flowers in the spring followed by bright red samaras (winged seeds) that persist well into the winter, providing visual interest and food for wildlife. Relatively adaptable to various soil conditions and tolerant of urban environments, it's often used as an ornamental tree in parks and gardens."
